{
  "total_items": 23,
  "storage_mb": 0,
  "hit_rate_percent": 0,
  "time_saved_hours": 0,
  "categories": {
    "vision": {
      "count": 5,
      "storage_mb": 0.0017175674438476562,
      "hit_count": 21
    },
    "embeddings": {
      "count": 1,
      "storage_mb": 0.00029087066650390625,
      "hit_count": 17,
      "expired_count": 0
    },
    "llm_responses": {
      "count": 17,
      "storage_mb": 0.05327415466308594,
      "hit_count": 1,
      "expired_count": 0
    }
  },
  "last_updated": "2026-05-25T19:20:35.295846"
}